sceneId,title,description,imagePath,itemName,itemDescription,choice1Text,choice1NextId,choice2Text,choice2NextId
1,Lobby,You wake up in a locked building lobby.,images2/lobby.png,none,none,Go to the Storage Room,2,Go to the Security Office,3
2,Storage Room,You find shelves full of old equipment.,images2/storage.png,Code Note,A paper with a door code written on it.,Go to the Hallway,4,Return to the Lobby,1
3,Security Office,A desk drawer is slightly open.,images2/office.png,Keycard,A plastic keycard labeled Level 1.,Go to the Hallway,4,Return to the Lobby,1
4,Hallway,A long hallway leads to the final exit door.,images2/hallway.png,none,none,Go to the Exit Door,5,Return to the Lobby,1
5,Exit Door,A locked exit door stands before you.,images2/exit.png,none,none,Try to unlock the door,5,Give up,1
